{
    "$schema": "http://json-schema.org/draft-07/schema#",
    "type": "object",
    "title": "Project Information",
    "description": "Information about a Quarto project",
    "properties": {
        "quarto": {
            "type": "object",
            "properties": {
                "version": { "type": "string" }
            }
        },
        "dir": {
            "type": "string",
            "description": "The path of the project directory"
        },
        "engines": {
            "type": "array",
            "items": { "type": "string" },
            "description": "The engines used in the project"
        },
        "config": {
            "type": "object",
            "description": "Resolved project configuration in JSON format"
        },
        "files": {
            "type": "object",
            "properties": {
                "input": {
                    "type": "array",
                    "items": { "type": "string" },
                    "description": "The input files in the project"
                },
                "resources": {
                    "type": "array",
                    "items": { "type": "string" },
                    "description": "The resource files explicitly provided in the project"
                },
                "configResources": {
                    "type": "array",
                    "items": { "type": "string" },
                    "description": "The resource files implied by the project configuration"
                },
                "config": {
                    "type": "array",
                    "items": { "type": "string" },
                    "description": "The configuration files in the project"
                }
            }
        },
        "fileInformation": {
            "type": "object",
            "additionalProperties": {
                "type": "object",
                "properties": {
                    "includeMap": {
                        "type": "array",
                        "items": {
                            "type": "object",
                            "properties": {
                                "source": { "type": "string" },
                                "target": { "type": "string" }
                            }
                        }
                    },
                    "codeCells": {
                        "type": "array",
                        "items": {
                            "type": "object",
                            "properties": {
                                "start": { "type": "integer" },
                                "end": { "type": "integer" },
                                "file": { "type": "string" },
                                "source": { "type": "string" },
                                "language": { "type": "string" },
                                "metadata": { "type": "object" }
                            }
                        }
                    }
                }
            }
        },
        "extensions": { "type": "array", "items": { "type": "object" } }        
    }
}