{
  "quarto": {
    "version": "1.3.0"
  },
  "dir": "/path/to/project",
  "engines": ["python", "r"],
  "config": {
    "project": {
      "type": "website"
    }
  },
  "files": {
    "input": ["index.qmd", "about.qmd"],
    "resources": [],
    "configResources": [],
    "config": ["_quarto.yml"]
  },
  "fileInformation": {
    "index.qmd": {
      "includeMap": [],
      "codeCells": [
        {
          "start": 1,
          "end": 15,
          "file": "index.qmd",
          "source": "import pandas as pd\npd.read_csv('data.csv')",
          "language": "python",
          "metadata": {
            "eval": "false"
          }
        }
      ]
    },
    "about.qmd": {
      "includeMap": [],
      "codeCells": []
    }
  },
  "extensions": []
}
